{
  "kind": "import-receipt",
  "schema_version": 1,
  "example": true,
  "canonicalization": "feltwillow-canonical-json-v1",
  "receipt_id": "imp-20261006T180500Z-0a1b2c3d",
  "outcome": "accepted",
  "errors": [],
  "handoff_id": "lion-and-mouse.en.h0001",
  "archive": {
    "sha256": "d7cc2a353c1f55a8da572d89a24b352dd3ff0b25bea32a91d1b9e54e8858bffa",
    "bytes": 8673280
  },
  "expected_archive_sha256": "d7cc2a353c1f55a8da572d89a24b352dd3ff0b25bea32a91d1b9e54e8858bffa",
  "expected_digest_source": "operator-out-of-band",
  "record_sha256": "4f7744538a870087fb4b4d7a0745da3b4632f8263372c78b2c2ac35af3c6adfd",
  "payload_sha256": "5cd530c3a34386b741fe950510ed7d88f3d76a1502a34bf4627263f86a9371de",
  "schema_version_seen": 1,
  "supersedes": null,
  "consumer_supports": [
    1
  ],
  "duplicate_of": null,
  "archival_locator": "handoffs/d7cc2a353c1f55a8da572d89a24b352dd3ff0b25bea32a91d1b9e54e8858bffa.tar",
  "promoted": true,
  "staged_at": "2026-10-06T18:05:00Z",
  "finished_at": "2026-10-06T18:05:09Z",
  "operator": "EXAMPLE-OPERATOR",
  "importer": {
    "tool": "feltwillow_publish.imports.importer (reference)",
    "tool_version": "0.2.0-h2",
    "publishing_commit": null
  },
  "authorizes_publication": false
}
